{"verification_result":
 "passed",
 "veribiota_version":
 "v0.2.1",
 "veribiota_build_id":
 "1406439d7674c36ffe1425f2b5a27a3d3eb2911d",
 "timestamp_utc":
 "2025-12-18T00:23:17Z",
 "theorem_ids":
 ["VB_ALIGN_CORE_001",
  "VB_ALIGN_CORE_002"],
 "snapshot_profile_version":
 "1.0.0",
 "snapshot_profile":
 "global_affine_v1",
 "snapshot_hash":
 "sha256:0e47a9ef809e1eaf0e3e31f9e44c0c6448de49229488359ab2ade44715d05a5f",
 "schema_id":
 "schemas/align/global_affine_v1.schema.json",
 "schema_hash":
 "sha256:5df162b1da0cbf116fd88b1068d913fcc1f0dddcb63862f8126faaf72673dacd",
 "lean_version":
 "4.9.0",
 "instance_summary":
 {"witness_score":
  1,
  "trace_score":
  1,
  "trace_length":
  1,
  "seqB_length":
  1,
  "seqA_length":
  1,
  "dp_score":
  1,
  "alignment_matches_spec":
  true}}